sentence,true_label
The theoretical single crystal elastic constants Cij are shown in Tables 3 and 4.,contradiction
"The corresponding bulk modulus (B), shear modulus (G), Young modulus (E), and Poisson's ratio (ν) are also obtained on basis of the Voigt–Reuss–Hill approximation.35 Clearly, our present elastic constants coincide with the previous theoretical values.11,21 As the Al concentration decreases, the modulus of MABs are strengthened.",contradiction
"For instance, the theoretical bulk modulus, shear modulus, and Young modulus of 222-MAB phases are in the range of 145–233 GPa, 101–145 GPa, and 252–361 GPa, while those values of 212-MAB phases are 152–262 GPa, 91–177 GPa, and 237–422 GPa, respectively.",entailment
It is noticeable that these values of MAB phases are comparable to or even higher than the corresponding MAX compounds.45 We further predict the Vickers hardness (Hv) of those MAB phases.,contradiction
"The average Hv from the empirical formula developed by ourselves37 are 12–26 GPa (Tables S1 and S2†), which is consistent with experimental value of 7.0–21.7 GPa.46 Among them, Ta2Al2B2, Cr2Al2B2, Mo2Al2B2, W2Al2B2, Sc2AlB2, Cr2AlB2, Mo2AlB2, W2AlB2, Mn2AlB2 possess higher modulus and hardness than other MAB phases.",contradiction
"Moreover, we examined the universal anisotropy index, Au.47 Au accounts for both compressibility and shear contributions and it can be positive or zero, zero Au value represents an isotropic crystal.",contradiction
"In Tables S1 and S2,† it is seen that most MAB compounds have high elastic anisotropies, except Cr2AlB2, Mo2AlB2 W2AlB2 and Fe2AlB2, which have notably low anisotropies (Au = 0.08, 0.13, 0.15 and 0.12, respectively) than the other compounds.",contradiction
"Thus, Cr2AlB2, Mo2AlB2 W2AlB2 with high modulus, high hardness and low elastic anisotropies are highly anticipated for future material applications.",contradiction
"The bulk modulus to shear modulus ratio, B/G, is an important measure of elasticity of a material.",contradiction
"Materials with a B/G < 1.75 are expected to be brittle, while materials with B/G > 1.75 are ductile.",contradiction
"The ratios B/G are also summarized in Tables 3, 4, Fig. 2(c) and (d).",contradiction
"It can be seen that the ratio of B/G for most 222-MAB compounds are in the range from 1.30 to 1.65, implying that they are brittle-like ceramics.",contradiction
"For the 212-MAB compounds, the values of B/G are in the range from 1.27 to 2.34.",contradiction
"The ductile materials are predicted for Tc2Al2B2, Nb2AlB2, W2AlB2, Tc2AlB2, Co2AlB2 and Ni2AlB2 with B/G values of 1.92, 1.79, 1.89, 1.97, 2.34 and 2.20, respectively.",contradiction
"In orthorhombic materials, the Cauchy pressure can be defined for the three different crystal directions: Pa = C23–C44, Pb = C13–C55, and Pc = C12–C66, while is also an indicator of ductile behavior.",contradiction
"As listed in Tables S1 and S2,† the Cauchy pressure of W2AlB2, Co2AlB2 and Ni2AlB2 are positive in all the three directions.",contradiction
"In short, a strong dependence of the elasticity with valence electron number is observed from Fig. 2(c) and (d).",contradiction
The B/G ratio of MABs increases with the increasing valence electron number.,contradiction
"By substitute different M element, these MAB phases can be tune from inductile to ductile.",contradiction
"For example, the ductility of 212-MAB compounds can be improved by alloying it with Tc, W, Co and Ni, or a combination of them.",contradiction
"The mechanical properties can be understood by their bond stiffness, tensile–stress curve, the work of separation, and the effective charge, respectively.",contradiction
"Based on the bond stiffness values listed in Fig. 2(e), (f) and Table S3,† we can summarize several findings.",contradiction
"Firstly, the bond stiffness values show the trend as B–B > M–B > M–Al > Al–B > Al–Al.",contradiction
"That is to say, the bond stiffnesses for intralayer B–B and B–M bonds are much larger than those for interlayer Al–M (Al–B/Al–Al) bonds.",contradiction
"Secondly, the high bond stiffnesses of B–B and B–M bonds mainly determine their mechanical properties.",contradiction
"One can observe relation of intralayer B–B, B–M bond stiffness as Mo2Al2B2 < W2Al2B2, which coincide with the tendency of experimental hardness value Hv (13.6 GPa10) of W2Al2B2 being lower than Hv (21.7 GPa10) of Mo2Al2B2.",contradiction
"Moreover, there is relation of intralayer B–B, B–M bond stiffness as Cr2AlB2 < Mn2AlB2 < Fe2AlB2, which also agrees with the relation of experimental Hv of three 212-MAB phases Cr2AlB2 (7.0 GPa) < Mn2AlB2 (9.6 GPa) < Fe2AlB2 (14.7 GPa).10 Analogously, some hypothetical compounds of Tc2Al2B2, Tc2AlB2 and W2AlB2 probably possess higher Hv value due to their higher bond stiffness of B–B and B–M bonds.",contradiction
"Thirdly, the mechanical properties of MAB phases are also affected by the ratio of the bond stiffness of the weakest bond to that of the strongest bond.",contradiction
"As listed in Tables S3 and S4,† Mn2Al2B2, Sc2AlB2, Zr2AlB2 and Nb2AlB2 have lower ratios, suggesting the contributions from interlayer weak M–Al, Al–B, Al–Al bonds to mechanical properties are also important, which will weaken the modulus and hardness to some extent.",contradiction
The relatively weak bond stiffness of the M–Al and Al–B bonds can be related to the delamination properties and the production mechanism of 2D derivatives.,contradiction
The tensile–strain relationships along the [001] stacking direction are illustrated in Fig. 3.,contradiction
The highest points on the stress–strain curves can be defined as ideal tensile strengths at the critical fractural strain.,contradiction
"The ideal tensile strength for 222-MAB are about 11–16 GPa from c axis, and the ideal tensile strength of 212-MAB compounds are 13–39 GPa, respectively.",contradiction
Such big difference in ideal strength is mainly attributed to their atomic arrangements.,contradiction
"The failure of 212-MAB is characterized by an abrupt stretch of the M–Al bonds, which is very similar to that of MAX phases.48 However, the failure of 222-MAB is characterized by an abrupt stretching of the Al–Al bonds (Fig. 3).",contradiction
"Since MAB (where M is a transition metal, A is an groups 13–16 element, and B is boron) phases possess good electrical conductivity, high-temperature oxidation and shock resistance, it is meaningful to develop a database to help us figure out optimal compositions and further promote their applications.",contradiction
"In this paper, we screened and studied all the available MABs with the M-site being one of the 3d, 4d, or 5d transition metals by using an ab initio method.",contradiction
"Among them, 23 MAB phases of M2Al2B2 (222-MAB phases with M = Ti, V, Nb, Ta, Cr, Mo, W, Mn, and Tc) and M2AlB2 (212-MAB phases with M = Sc, Ti, Zr, Hf, V, Nb, Cr, Mo, W, Mn, Tc, Fe, Co, and Ni) stand out in terms of structural stability and their electronic, mechanical, optical and thermodynamic properties have been investigated.",contradiction
"For both types of MAB phases early transition elements are more feasible to synthesize than post transition elements, because of the lower number of valence electrons and lower formation energy.",contradiction
The effect of valence electron concentration and composition of MAB compounds could also enable fine tuning of their mechanical properties.,contradiction
"The bulk modulus, shear modulus, and Young's modulus of the 222-MAB phases are in the range of 145–233 GPa, 101–145 GPa, and 252–361 GPa, respectively, while they are 152–262 GPa, 91–177 GPa, and 237–422 GPa for the 212-MAB phases, respectively.",entailment
"Their mechanical ductilities also show strong valence electron number dependency, with their maximum value occurring at Ni2AlB2 and Co2AlB2, respectively.",contradiction
"More interestingly, a low thermal expansion coefficient and good high temperature strength have also been found in those MAB phases, which are favorable for their potential applications as refractory materials.",contradiction
"In addition, the possibility of forming new two-dimensional (2D) materials from layered MAB phases, termed MBenes, is predicted by investigating the interplay of the tensile strain, complex chemical bonding and exfoliation energy.",contradiction
"We have systematically investigated the stable structural and magnetic state of Fe–Cr alloy, the stability of interstitial He structure, the migration of interstitial He, the electronic properties and its bonding interaction by ab initio first-principles method.",contradiction
"The calculated bulk modulus of 284.935 GPa in the NM state is in good agreement with the computed values 282 and 293 GPa obtained by Jiang et al. and Herper et al. However, in the AFM, AFMD and FM states, the bulk modulus calculated by ours are larger or smaller than that computed by others.",entailment
"We employed mechanical stability criterion and lattice dynamics conditions to strictly screen out two stable substitution positions S1 and S2, taking into account the magnetic states of AFM and NM.",contradiction
"Compared with bulk γ-Fe, a slightly larger Young's modulus indicates that the doping of Cr helps to enhance the stiffness of the material and the ability to resist the reversible deformation of shear stress, but the ductility decreased slightly.",contradiction
"For configurations S1 and S2, the larger G/B ratio [0.457 (0.459)], smaller Poisson's ratio [0.302 (0.301)] and smaller anisotropic factor [2.288 (2.282)] in the AFM state imply that the relative directionality of bonding in Fe–Cr alloys increases, but the ductility and the degree of elastic anisotropy of the material decreases slightly.",contradiction
"Our results revealed that the addition of interstitial He atom promotes the expansion and deformation of the lattice, and further enlarges the cell volume.",contradiction
Compared with bulk iron the substitution of Cr for Fe promotes He migration between octahedral interstitials and hinders He diffusion between tetrahedral interstitials.,contradiction
"For the diffusion between tetrahedron and octahedron interstitials, we found two opposite effects of alloy element Cr, i.e., for model S1, the existence of Cr largely hinders the migration of single helium, while for S2, the addition of Cr promotes the diffusion of helium to some extent.",contradiction
"For the migration between tetrahedron interstitials, the relative energies of S1 and S2 show two completely different trends, i.e. the relative energies of S1 are all negative, while the relative energies of S2 are almost positive.",contradiction
"It can be concluded that in model S1 and its bulk iron, helium atom may realize the diffusion from T1 to T3, but the presence of Cr obstructs the migration of helium from T3 to T4 to some extent.",contradiction
"For model S2 and its bulk iron, we found that the presence of Cr atom in the alloy structures greatly restrains the diffusion of a single helium atom, which seems to be trapped in tetrahedral interstitial and cannot escape.",contradiction
"The results of electronic properties show that the alloy materials exhibit obvious metallicity, and the doping of Cr generate an impurity state at lower energy, which is mainly formed by s, p of Fe and s, p shell electrons of Cr.",contradiction
"The charge density difference graphs show that there are charge depletion zone near Cr atom in both AFM and NM states, while there are charge aggregation in the region between Fe and Cr, indicating that there is bonding interaction between Fe and Cr atom.",contradiction
Bader charge analysis show that the stronger polar covalent bond is formed between Fe and Cr in the NM state than that in the AFM state.,contradiction
We have performed the first-principles method to study the structural stability and helium diffusion behavior of Fe–Cr alloys.,contradiction
The calculated bulk modulus of 284.935 GPa in the non-magnetic (NM) state is in good agreement with others.,entailment
We have obtained solid evidence that the alloy structures meet the mechanical stability criteria and lattice dynamics conditions in the anti-ferromagnetism (AFM) and non-magnetic (NM) states.,contradiction
"The presence of Cr in the alloy structures promotes the migration of a single helium atom between octahedral interstitials, and at the same time, inhibits the diffusion of helium atoms between tetrahedral interstitials to a large extent, which seem to be trapped in tetrahedral interstitials and cannot escape.",contradiction
"The electronic properties show that the alloy materials exhibit obvious metallicity, and the doping of Cr generates an impurity state at lower energy, which is mainly formed by the s, p of Fe and s, p shell electrons of Cr.",contradiction
The charge density difference graphs corroborate that there is bonding interactions between Fe and Cr atoms.,contradiction
Bader charge analysis shows that a stronger polar covalent bond is formed between Fe and Cr in the non-magnetic (NM) state than in the anti-ferromagnetism (AFM) state.,contradiction
Our results provide useful information for understanding the initial growth of helium bubbles in experiments.,contradiction
Zinc pyrovanadate (Zn2V2O7) and related compounds are receiving a great deal of attention because of the multiple practical applications of these compounds.,contradiction
"The applications include hydrogen storage,1 photocatalytic water splitting,2 batteries,3 and supercapacitors,4 among others.",contradiction
"These vanadates not only have optimal optical and electronic properties for such uses, but also are chemically stable under mild alkaline conditions.",contradiction
"As a consequence, their properties are being currently systematically studied.  ",contradiction
"According to X-ray diffraction experiments, Zn2V2O7 experiences three structural phase transitions under relative small compression (pressure < 11 GPa), while in the other compounds there are no phase transitions in the same pressure range.7 In particular, in Zn2V2O7 the transition from the ambient-pressure monoclinic polymorph (α-phase) to another monoclinic polymorph (β-phase) occurs at 1.1 GPa (ref. 7) and subsequent transitions take place at 3.8 GPa) (to a triclinic polymorphs named as γ-phase) and 10.8 GPa (post-γ-phase).7 For two of the high-pressure (HP) polymorphs (β and γ) a crystal structure has been proposed from previous X-ray diffraction studies; however, the crystal structures have not been properly solved.7 The proposed structures involve large changes in the unit-cell volume and a modification of the coordination polyhedra.",contradiction
"Therefore, they are expected to affect other physical properties, in particular, the electronic band gap.8 However, the influence of high-pressure on the electronic properties of Zn2V2O7 has not been studied yet.",contradiction
Thus additional HP studies on Zn2V2O7 are relevant and timely.,contradiction
"Density-functional theory (DFT) calculations have proven to be a quite efficient tool to study the HP behavior of ternary oxides, and in particular vanadates.9–12 In this work, we will use this technique to examine the existence of pressure-driven phase transitions in Zn2V2O7.",contradiction
"By considering the previously proposed HP crystal structures7 for this compound and other candidate structures, we have obtained a structural sequence, which will be compared to previous experiments.7 In addition, to crystallographic information on the different structures, we will also report their compressibilities and equations of state as well as their band structures and electronic densities of states.",contradiction
"The band-structure calculations here reported support that Zn2V2O7 is a wide band-gap material, clarifying discrepancies found in the literature with values for band-gap energy (Eg) going from 2.5 to 3.5 eV.",contradiction
Ba3MoNbO8.5 is an oxide ion conductor with an unconventional hybrid crystal structure that is intermediate between the 9R-perovskite (A3B3O9) and the palmierite (A3B2O8).,contradiction
"The crystal structure is highly disordered with vacancies distributed across two cation (M(1) and M(2)) and oxygen sites (O(2) and O(3)), with Mo and Nb in variable coordinate environments.",contradiction
"M(1)–O(1)–O(2) and M(2)–O(1) sites are associated with the formation of (Mo,Nb)O6 octahedra, whilst tetrahedral units are composed of M(1)–O(1)–O(3) atoms.",contradiction
"Upon increasing the temperature, the structure undergoes a change in occupancy in favour of the O(3) site, which results in a change in metal co-ordination as the tetrahedral to octahedral ratio increases.",contradiction
We demonstrate that the structure can also be tuned using externally applied pressure.,contradiction
"Variable pressure studies ≤4.8 GPa indicate that densification of the unit cell induces the reverse effect, as the occupancy of the O(2) site increases and the palmierite contribution is suppressed.",contradiction
Our results strongly suggest that by 5.2 GPa the O(3) position will be completely empty as the 9R unit cell stabilises with a network of octahedral MO6 units.,contradiction
"Pressure induces a flattening of M(1)O4 tetrahedra in the palmierite layers, as M(1)O6 octahedra become more regular in geometry.",contradiction
"Bond valence site energy calculations show that pressure increases the height of all energy barriers to migration along the three-dimensional diffusion pathways, increasing the energy of the dominant pathway from 0.35 to 0.95 eV.",contradiction
"The relaxation energy, E2, disappears above 2.8 GPa, when the average polyhedral distortion (σ(R)) falls below 0.07 Å, indicating the existence of a critical minimum.",contradiction
"In addition to technological applications, Zn2V2O7 has recently raised attention because of its interesting behavior under high-pressure conditions.",contradiction
"In particular, it has been reported that Zn2V2O7 (with a bulk modulus of 58 GPa (ref. 7)) is extremely more compressible that related vanadates like ZnV2O6 and Zn3V2O8 (with bulk moduli of 129 and 120 GPa, respectively).",contradiction
"Not only that, differences between the compressibility of Zn2V2O7 and other vanadates also affect the structural stability under compression.",contradiction
"Therefore, variable pressure physical property measurements are warranted in order to investigate the use of these materials for multiparameter (P–T–H) triple sensors based on their conductivity response to pressure, temperature and humidity stimuli.",contradiction
The bulk modulus of Ba3MoNbO8.5 is exceptionally low (50(2) GPa) for a layered oxide material and is closer to that of the halide perovskites.,entailment
"These results demonstrate a high degree of flexibility, in terms of the softness of the lattice and variable metal coordination, emphasising the potential for these materials in multi sensory and thin film applications.",contradiction
We have reported the pressure response of Ba3MoNbO8.5 between 0.1 MPa and 4.8 GPa.,contradiction
"In contrast with temperature, the hybrid structure undergoes a re-distribution in the population of disordered O(2) and O(3) sites, favouring the occupancy of the former and therefore decreasing the tetrahedral: octahedral ratio.",contradiction
"Our estimations indicate that all palmierite character, and associated tetrahedral environments, will be eradicated by 5.2 GPa.",contradiction
"The change in structure is reversible, as data obtained upon decompression reveals that the oxygen site occupancies revert to their original equilibrium values.",contradiction
This variable pressure study highlights the inherent flexibility of this disordered material and the ability to subtly tune its hybrid structure using both pressure and temperature.,contradiction
"The anionic lattice undergoes a smooth and continuous change in occupancy with P, while the metal cation lattice is more robust to pressure showing no discernible change at pressures < 3.8 GPa.",contradiction
"The highly distorted structure of Ba3MoNbO8.5 at ambient pressure becomes less distorted with P, as the average σ(R) value falls and the second order Jahn–Teller distortion is suppressed.",contradiction
Examination of individual polyhedral environments indicates that more regular octahedra are generated within the unit cell at the expense of increasingly distorted and flattened tetrahedra.,contradiction
"These combined factors act to increase the energy barriers for migration along all available pathways, changing the energy landscape of Ba3MoNbO8.5. Moreover, we show that there is likely a critical value of σR, and Ba3MNbO8.5 materials with values below 0.07 Å will lack the E2 relaxation energy associated with the distortion of MOx polyhedra.",contradiction
The crossover in E1 energy demonstrates that the absence of this relaxation energy has a significant effect on the two-dimensional transport.,contradiction
This is a key feature within the energy landscape of the Ba3M′M′′O8.5 family and will be an important consideration for the future synthesis of materials.,contradiction
"The combination of an unfavourable polyhedral ratio, the overall reduction in distorted environments and the compression of the unit cell volume all act to drive up the energy barriers to migration of the oxide ions within the plane and along c.",contradiction
These findings indicate that pressure will most likely suppress ionic transport within the Ba3M′M′′O8.5 family.,contradiction
"Previous studies indicate considerable water uptake within the Ba–O(2)–O(3) layers which effects the disordered distribution of oxygen and, therefore, the conductivity response.  ",contradiction
The low bulk modulus also explains why such facile structural transformations are enabled with both pressure and temperature.,contradiction
Most of the calculation results are for the composition having the atomic ratio of Zn : Sn : O = 1 : 1 : 3.,contradiction
"This is referred to as the ZTO113 composition, which is different from ZTO113, denoting the ZnSnO3 phase.",contradiction
"Some results will also be described for the composition having the atomic ratio of Zn : Sn : O = 2 : 1 : 4, which will be referred to as the ZTO214 composition.",contradiction
"For ZTO113, two phases were examined: the lithium niobate phase (R3c, space group 161; LN-ZTO113) and the ilmenite phase (R[3 with combining macron], space group 148; IL-ZTO113).",contradiction
"They have rhombohedral primitive cells;38 however, hexagonal unit cells were used in the ab initio calculations for convenience.",contradiction
"In the hexagonal cell, Zn, Sn and a vacancy occupy the octahedral sites in distinctive ways.",contradiction
"In IL-ZTO113, a plane normal to the 〈0001〉 direction is occupied by one cation species or a vacancy, whereas it is occupied by the mixture of Zn, Sn and vacancies in LN-ZTO113.",contradiction
"The stable phase of ZTO214 was reported to be an inverse spinel.12–15 If all of the octahedral sites are treated as symmetrically identical due to cation disordering, it is called a disordered inverse spinel ZTO214 (DIS-ZTO214), which belongs to the space group Fd[3 with combining macron]m as the normal spinel.15 However, on the atomic scale, the occupancy of octahedral sites by two different metal elements might lower the symmetry of the structure, which is called an ordered inverse spinel ZTO214 (OIS-ZTO214).",contradiction
"For OIS-ZTO214, three configurations were investigated: a tetragonal phase (P4122, space group 91; tetra-ZTO214),15 an orthorhombic phase (Imma, space group 74; ortho-ZTO214)22 and a monoclinic phase (P1, space group 1; mono-ZTO214).",contradiction
"Other unit cells, belonging to the space groups P[4 with combining macron]m2 and Cm, were found to change into ortho-ZTO214 via relaxation of the shape and volume of the cells.",contradiction
"Meanwhile, the volume, energy, and the vibrational properties of DIS-ZTO214 were obtained by averaging over eight different OIS-ZTO214 cells.",contradiction
"Six of them were constructed by generating random numbers to have different fillings of the octahedral sites by Zn and Sn, where each individual structure was a mono-ZTO214.",contradiction
Tetra-ZTO214 and ortho-ZTO214 were also included as samples to obtain the average properties of the DIS-ZTO214.,contradiction
"Note that tetra-ZTO214 was calculated to have the lowest energy,15 and this was also confirmed by this calculation.",contradiction
"The primitive cell of each phase was defined in comparison with the conventional unit cell of the cubic spinel, as shown in Fig. 3.",contradiction
"Tables 2 and 3 show the volume of the unit cell and the bulk modulus for each phase from the LDA and GGA calculations, respectively.",contradiction
They also show the comparison with experimental values and some previous calculation results.,contradiction
ZnO in the wurtzite structure and SnO2 in the rutile structure were also calculated as references.,contradiction
"The volumes and bulk moduli were obtained from the BM-EOSs.29 The difference between the energy obtained using the relaxed volume and that obtained using the volume fitted to the EOS was negligible, below 1 meV f.u.−1.",contradiction
"The calculated volumes of the optimized cells agree well with the experimental data, to within an error of 5%.",contradiction
"The volumes obtained from the LDA calculations are slightly smaller and those obtained from the GGA calculations are slightly larger than the experimental values, as observed for many other materials.25 The volumes from the LDA calculations were closer to the experimental data than those from the GGA calculations.",contradiction
