sentence,true_label
"The data in Table 2 show that U3Si2, sub-U3Si1.5Al0.5 and sub-U2.5Si2Al0.5(I) are all brittle materials, but the B/G values of sub-U3Si1.5Al0.5 and sub-U2.5Si2Al0.5(I) after alloying are significant increase and very close to 1.75.",contradiction
"Therefore, we can understand that alloying could improve the toughness of the material.",contradiction
"In addition, Poisson's ratio is also calculated using the following eqn (2): According to Frantsevich's theory, the value of σ could also be used as a criterion for judging whether the material has ductility, and 0.26 is defined as the critical value.39 The calculation results of U3Si2, sub-U3Si1.5Al0.5 and sub-U2.5Si2Al0.5(I) σ are shown in Table 2.",contradiction
"The σ values of the three compounds are all less than or equal to 0.26, indicating that they are all brittle materials.",contradiction
"However, sub-U3Si1.5Al0.5 and sub-U2.5Si2Al0.5(I) have a significant increase compared with U3Si2, which is consistence to the conclusion of B/G.",contradiction
"The anisotropy of elasticity could be characterized by anisotropy index Au, which was proposed by Ranganathan and Ostoja-Starzewski40 and is derived by eqn (3): where Au = 0 indicates isotropic for a structure, and the degree of anisotropy is determined based on the deviation from 0.",contradiction
"Next, the three optimized compound crystal structures are taken into consideration, among which U3Si2 belongs to the tetragonal structure, while both of sub-U3Si1.5Al0.5 and sub-U2.5Si2Al0.5(I) belong to the orthogonal structure.",contradiction
"For orthorhombic crystals, the corresponding BV and BR are the bulk modulus; GV and GR are the shear modulus can be calculated by eqn (4)–(7):41 For the tetragonal structure, the same variables from shear modulus, as well as the variables from bulk modulus can be calculated by eqn (8)–(11):42,43 Sij is the elastic compliance constant, and Cij is the elastic constant.",contradiction
"From the Au value in Table 2, it can be concluded that U3Si2 has the lowest anisotropy is, followed by sub-U3Si1.5Al0.5, and finally sub-U2.5Si2Al0.5(I).",contradiction
"Next, the three-dimensional Young's modulus diagram is used to visually explore the anisotropy of elasticity.",contradiction
"For tetragonal and orthogonal structures, the three-dimensional Young's modulus is expressed using eqn (12) and (13):44,45 The isotropic materials would display a three-dimensional spherical structure; otherwise, the solid material is anisotropic one.",contradiction
"The larger the deviation to spherical structure, the higher the anisotropy.",contradiction
Fig. 4 shows the three-dimensional Young's modulus calculated from the above formula.,contradiction
"The curved surface for U3Si2 is close to a circle, and its Au value is 0.13; while the Au values of sub-U3Si1.5Al0.5 and sub-U2.5Si2Al0.5(I) are 0.32 and 1.27 respectively, indicating that U3Si2 has the strongest isotropy, followed by sub-U3Si1.5Al0.5, and the most anisotropy belongs to sub-U2.5Si2Al0.5(I).",contradiction
"In order to further study the anisotropy of elasticity, 2D plane projections along the directions of [100], [010] and [001] have also been added into Fig. 4.",contradiction
"For U3Si2, the maximum Young's modulus is 150 GPa, while sub-U3Si1.5Al0.5 is 130Gpa, and sub-U2.5Si2Al0.5(I) is 110 GPa.",contradiction
"Therefore, it can be concluded that the sub-U3Si1.5Al0.5 still maintains high isotropy, and the Young's modulus of the structure does not change much, while the sub-U2.5Si2Al0.5(I) shows out of the strong anisotropy, the Young's modulus decreases significantly.",contradiction
The conclusions are consistent with the result determined by the Au value.,contradiction
"The thermal conductivity is an important property of nuclear fuel, since it determines the surface and centerline temperature of nuclear fuel during operation, as well as its maximum allowable direct heating rate.",contradiction
Phonons play an important role in dynamic behavior and thermal properties.,contradiction
The thermal conductivity of U3Si2 mainly comes from the contribution of phonons and electrons due to its metallic nature.,contradiction
"In this section, we employ first-principle calculations to derive the phonon–phonon interaction strength.",contradiction
"By solving the linearized Boltzmann transport equation, the lattice thermal conductivity in different directions can be accurately calculated; where the electronic transport properties are approximated with the relaxation time Ï„ = 0.68 Ã— 10âˆ’14 s evaluated using Ï at 300 K obtained from experiments.46 The anisotropic lattice thermal conductivity of U3Si2, sub-U3Si1.5Al0.5 and sub-U2.5Si2Al0.5(I) is calculated, as shown in Fig. 5(aâ€“c), the inset is the curve of Kzz/Kxx with temperature.",contradiction
It is worth noting that smaller values of Kl in the x- and z-directions have recently been reported in ref. 47 with the consideration of the occupation matrix control (OMC).,contradiction
"In comparison, the results obtained within this work using VASP with the consideration of the U ramping method; and this is known as a source of discrepancies in DFT + U calculations.",contradiction
"As shown in the Fig. 5(a–c), as the temperature increases, the lattice thermal conductivity of the three compounds decreases drastically until it becomes flat.",contradiction
This is because the scattering between phonons and phonons strengthens with the increase of temperature.,contradiction
It can be seen from the illustration that the Kzz/Kxx of U3Si2 is 1.3 at 50 K.,contradiction
"As the temperature increases, it rises to a saturation value of 1.65 at about 300 K, and then gradually stabilizes.",contradiction
The general trends of sub-U3Si1.5Al0.5 and sub-U2.5Si2Al0.5(I) are similar to those of U3Si2.,contradiction
"The same, but the saturation value is different, the former is 2.95 and the latter is 10.5. Therefore, we understand that through alloying, the lattice thermal conductivity still maintains a high isotropy as the temperature increases.",contradiction
"This isotope of the thermal conductivity of the phonon is caused by the dispersion phase space and the similar group velocities in different directions.48Fig. 5(d) shows the calculated electronic thermal conductivity (Ke/τ), U3Si2, sub-U3Si1.5Al0.5and sub-U2.5Si2Al0.5(I); and it can be seen from the figure that the electronic thermal conductivity of the three compounds all increase linearly with the increase of temperature.",contradiction
"In addition, for the compound of sub-U3Si1.5Al0.5 configuration, the increase rate of the electronic thermal conductivity with the increase of temperature is lower than that of U3Si2, while the increase rate of the compound of sub-U2.5Si2Al0.5(I) configuration is higher than that of U3Si2.",contradiction
"Apparently, Raman measurements and X-ray diffraction patterns suggested strongly contrasting high-pressure behaviors of the same TiO2 nanomaterials.",contradiction
"First of all, it is well known that upon compression, anatase bulk TiO2 undergoes a phase transition sequence from anatase phase to α-PbO2 phase, and then to baddeleyite phase.22,23 For nanostructured TiO2 materials such as nanoparticles and nanowires, however, anatase phase generally transforms directly into baddeleyite phase upon compression.31,34,37,39,43 Table 1 summarizes the phase transition sequences of different TiO2 materials.",contradiction
"For TiO2 nanoparticles in particular, the phase transition sequences are found strongly particle size dependent.",contradiction
"The anatase to baddeleyite phase transitions was found only in the mid-sized TiO2 nanoparticles (i.e., 12–50 nm).",contradiction
"Outside this range, the TiO2 nanoparticles exhibit either same phase transition sequence as bulk materials (when >50 nm) or become amorphous (when <12 nm) upon compression.",contradiction
Our previous studies on anatase TiO2 nanowires with different wire diameters suggest that the transition sequence is not size dependent and follows that of mid-sized nanoparticles.,contradiction
"In this study, given that the electrochemically synthesized TiO2 nanotubes are several tens of microns long (i.e., comparable to bulk materials), the tube diameter thus is the determining dimension.",contradiction
"Even though the tube diameter of 100 nm is two times larger than the critical size of 50 nm for nanoparticles, the deletion of the α-PbO2 phase is still found upon compression.",contradiction
"This observation is similar to that of anatase TiO2 nanowires with similar or larger sizes.37,39 Therefore, it is reasonable to conclude that, in contrast to nanoparticles, morphology has more prominent effect than size in affecting high pressure behaviors of 1D TiO2 nanomaterials.",contradiction
"So far, there were several attempts to explain why α-PbO2 phase was hindered in anatase TiO2 nanomaterials.",contradiction
"A widely accepted interpretation was that nanostructured TiO2 has enhanced surface energy compared to the bulk counterparts, although some other factors such as the imperfections of the crystals may also contribute.30,35,43 Nonetheless, the rational correlation between the phase stability and dimensions of the nanostructures is still not fully understood.",contradiction
"In the Raman measurements, contrastingly, no phase transition is found upon compression up to 17.7 GPa, a pressure substantially higher than the transition onset pressure (i.e., ∼14 GPa) found in the XRD measurements.",contradiction
"In the case of TiO2 nanowires, Raman measurements clearly suggests the anatase-to-baddeleyite transition at similar pressures, consistent with the XRD measurements.39 We then carefully examined the difference between these different experiments.",contradiction
We noted that silicon oil was used as the PTM in Raman measurements while neon was used in the XRD experiments.,contradiction
"Although neon provides a better hydrostatic condition above 10 GPa than silicon oil, the difference in the hydrostaticity is unlikely the primary factor for the different compression behavior of TiO2 nanotubes.",contradiction
"Given the large tube diameter and open end morphology of the TiO2 nanotubes, as well as the chemical inertness of the PTM, the interaction between PTM with different molecular sizes and TiO2 nanotubes is expected to be similar.",contradiction
"Indeed, in Li et al.’s similar study on TiO2 nanotubes where 4[thin space (1/6-em)]:[thin space (1/6-em)]1 methanol–ethanol mixture as PTM was used, it was believed that PTM can penetrate into the tubes even with much a smaller diameter (i.e., ∼5 nm).40 Based on these analyses, we believe TiO2 nanotubes in the current study have substantially different and more complicated surface or interfacial structures than nanowires studied before or the nanotubes in Li's study.",contradiction
"In particular, the large tube diameter (i.e., ∼100 nm) and the wall thickness (i.e., ∼10 nm) as well as the way the tubes are aligned upon production may result in a much more inhomogeneous pressure response along the radial direction upon compression.",contradiction
"As a result, the inner part of the tube and tube surface layers may undergo different transition sequence.",contradiction
"Considering that Raman spectroscopy is a surface sensitive probe while that bulk penetrating X-ray provides information involving long-range orderness, we may conclude that the bulk TiO2 nanotubes and especially the inner layers transform to baddeleyite phase whereas the surface layers become amorphous upon compression.",contradiction
"In order to further reconcile the â€œdiscrepancyâ€ between Raman and XRD measurements as well as to probe the transition mechanism, the full width at half maximum (FWHM) of the most intense Eg(1) mode for TiO2 nanotubes is plotted in Fig. 5.",contradiction
"Two tuning points (labeled as P1 and P2) are found at 6 GPa and 14 GPa, respectively, consistent with the observation in TiO2 nanowires reported before.39 For TiO2 nanowires, P2 coincides with the anatase to baddeleyite phase transition pressure.",contradiction
"Interestingly, the P2 in the current study, which is 14 GPa, is also coincidental with the anatase to baddeleyite phase transition pressure identified in the XRD measurements.",contradiction
"This coincidence may suggest that the anatase to baddeleyite phase did occur, although undetectable in the Raman measurements given the above discussion.",contradiction
"Based on our earlier high-pressure study of TiO2 nanowires, these two turning points are consistent with the three-stage process proposed for the phase transition, which involves the competition between formations of the α-PbO2 phase and baddeleyite phase.",contradiction
"In the first stage (0 GPa – P1), specifically, the anatase to α-PbO2 phase transition route may be favored.",contradiction
"However, due to the enhanced surface energy, a high energy barrier for the formation of the α-PbO2 structure could substantially delay the transition to the α-PbO2 phase.45 Therefore, before the α-PbO2 phase is eventually formed, the baddeleyite phase became the more energetically favored structure in competition with the α-PbO2 phase at the second stage (P1 – P2), as seen in Fig. 5.",contradiction
"At the third stage (>P2), the phase transformation followed anatase-to-baddeleyite route monotonically, accompanied by the significantly faster increase in the FWHM of the Eg(1) mode than the first two stages.",contradiction
Fig. 5 FWHM of the Eg(1) Raman mode as a function of pressure for TiO2 nanotubes.,contradiction
The solid lines are for eye guidance only.,contradiction
P1 and P2 denote the first and second turning pressure points upon compression.,contradiction
"Furthermore, detailed analysis of the XRD results of TiO2 nanotubes allows the understanding of the pressure dependence of unit cell parameters as well as the compressibility in comparison with earlier studies of bulk and nanostructured TiO2 materials.",contradiction
"The normalized unit cell lengths (i.e., a/a0 and c/c0) as a function of pressure for the TiO2 nanotubes are plotted in Fig. 6 in comparison with the corresponding bulk materials.",contradiction
"First of all, the c-axis exhibits a linear compressibility that is three times larger than a-axis, consistent with earlies studies on bulk TiO2[thin space (1/6-em)]24,47 as well as TiO2 nanowires.37,39 The different compressibilities are believed to be associated with the intrinsic anatase crystal structure.",contradiction
"Specifically, there are four occupied TiO6 octahedra and four empty O6 octahedra per unit cell.",contradiction
The Ti atom inside the occupied octahedra (TiO6) makes the polyhedra much harder to compress than the empty ones (O6).,contradiction
Thus the higher compressibility of the c-axis than the a-axis can be interpreted in terms of the difference in the directional population of the hard occupied (TiO6) and soft empty (O6) oxygen octahedra.,contradiction
The specific c/a compression ratio further indicates a consequence of the alignment of the empty O6 octahedra along the c-axis and of the greater density of atoms along the a- and b-axes than along the c-axis.,contradiction
"Moreover, compared to bulk TiO2, the c-axis of TiO2 nanotubes shows higher compressibility, while the compressibility along a-axis is similar.",contradiction
"In general, the c-axis for all the nanostructured anatase TiO2 is more compressible than the corresponding bulk material, indicating that the morphology and the crystalline growth direction of TiO2 nanomaterials play an important role in the anisotropic behavior.34,37 Fig. 6 Pressure dependences of cell parameters of anatase TiO2 nanotubes in comparison with those of bulk TiO2.",contradiction
"Open and solid symbols denote the cell parameters of the TiO2 nanotubes and bulk TiO2 cited from ref. 24, respectively.",contradiction
"Circles and squares represent a/a0 and c/c0 ratios, respectively.",contradiction
The solid lines are just for eye guidance.,contradiction
The pressure-volume data of TiO2 nanotubes are shown in the Fig. 7.,contradiction
"By fitting the third-order Birch–Murnaghan equation of state (EOS), the bulk modulus (B0) of the anatase and baddeleyite phases for TiO2 nanotubes obtained are 164.2 GPa and 182.8 GPa, respectively, with the first derivative (B′0) fixed at 4.",entailment
"For comparison purposes, the bulk modulus of the anatase phase of corresponding bulk materials, nanoparticles and nanowires are plotted together with TiO2 nanotubes.",contradiction
"Similar to Li et al.’s study on TiO2 nanotubes with a much smaller diameter (i.e., ∼10 nm) for which the bulk modulus was reported to be 158 GPa, the bulk modulus of TiO2 nanotubes in the current study (i.e., 164 GPa) is also slightly lower than that of TiO2 bulk materials (i.e., 179 GPa), indicating the dimension of the TiO2 nanotubes has a negligible influence in the compressibility.",entailment
"In contrast, other nanostructured TiO2 materials such as nanowires and nanoparticles showed substantially enhanced bulk modulus, e.g., 266.5 GPa and 243 GPa, respectively.",entailment
"In addition, morphology-induced alterations of bulk modulus have been reported in high-pressure studies of other TiO2 nanomaterials.",contradiction
"For example, strongly contrasting compressibilities were observed for TiO2 nanoparticles with rod and rice shapes.34 The bulk modulus of rod-shaped particles was reduced, whereas that of the rice-shaped particles was enhanced by over 50% relative to the corresponding bulk materials.34 All these observations suggest that morphology plays a dominant role in the compressibility of different TiO2 nanostructures due to the different contribution of surface energy states.",contradiction
"Fig. 7 Pressure dependence of the unit cell volume for the anatase phase of TiO2 nanotubes in comparison with that for bulk, nanowires, and nanocrystals.",contradiction
The inset figure shows the EOS of baddeleyite phase of TiO2 nanotubes.,contradiction
The solid squares are from this work.,contradiction
The solid lines represent fitting to the third order Birch–Murnaghan EOS.,contradiction
Another interesting observation is that the baddeleyite phase exhibited a much higher bulk modulus in TiO2 nanotubes than nanowires (182.8 GPa vs. 127.8 GPa). ,entailment
"The SEM image of the recovered materials (Fig. 1b) shows that although the alignment of the nanotubes was substantially modified, the tube morphology is still clearly distinguishable.",contradiction
"Dotted lines, dashed lines, and dash dotted lines are the EOS for bulk, nanowires and nanocrystals reported from ref. 24, 40 and 43, respectively.",contradiction
"The preservation of the morphology on compressed materials has great implications for new applications and has been reported for TiO2 nanowires and nanotubes before.37,40 In addition to the open-end tube morphology and use of PTM as important factors, we believe the high stillness of baddeleyite lattice during the anatase-to-baddeleyite transition in TiO2 nanotube also contributes to the morphology stability upon compression.",contradiction
"Indeed, in our earlier studies of TiO2 nanowires for which the baddeleyite phase has a lower stiffness, the wire morphologies were not preserved.39 Finally, the interplay of multiple factors must be considered collectively to interpret the different mechanical properties, phase stability as well as transition sequence of nanomaterials.",contradiction
"For instance, the anatase TiO2 nanorods grown along the a-axis showed a lower bulk modulus (243 GPa) than TiO2 nanorices grown along the c-axis (319 GPa).",entailment
Park et al. suggested that bulk modulus may be influenced by the crystal growth directions of TiO2 nanomaterials.,contradiction
"Their nanowires have the same growth direction as the nanorods, given a similar bulk modulus of 176 GPa as the bulk counterpart (i.e., 179 GPa).",entailment
Li et al. obtained the similar results in the study of anatase TiO2 nanowires.,contradiction
"Therefore, we can infer that the primary growth direction of TiO2 nanotubes synthesized in this study is also along a-axis.",contradiction
"However, our TiO2 nanotubes exhibit a â€œnormalâ€ transition sequence whereas those produced by Li et al. suggest that only amorphous TiO2 with different densities was observed upon compression.40 Crystalline defects and lattice impurities, which strongly depend on synthetic methods, can substantially influence the structural stabilities at the nanoscale.48,49 Indeed, plenty of crystal defects were identified in the hydrothermally synthesized TiO2 nanomaterials.40 Our Raman results on electrochemically synthesized TiO2 nanotubes suggest inhomogeneous interfacial structures, from which crystal defects can also be inferred, but likely with a different distribution along and across the nanotubes at nanoscale.",contradiction
"Ultimately, it would be of great interest to fabricate energy devices based on TiO2 nanotubes produced via different routes both in the as-made form and retrieved from compression and to test the performance comparatively for practical applications.",contradiction
Fig. 1 shows the final atomic structures of 64 C atom-containing a-C films with an increase in the atomic density (3.2 to 4.0 g cm−3) and hydrogen concentrations (15.6 to 31.2 at%).,contradiction
The dependence of the calculated bulk modulus on the atomic density is illustrated in Fig. 2(a).,contradiction
"In the case of the reference a-C film (Ref. a-C), a bulk modulus of about 212 GPa was estimated.",entailment
"With the increase in atomic density, the bulk modulus drastically increased; when the atomic density was 4.0 g cm−3, a maximal bulk modulus of about 617 GPa was obtained, which was around three-fold larger than that of the reference a-C film.",entailment
"On the other hand, on introducing H atoms in the a-C films, as shown in Fig. 2(b), the bulk modulus as a function of the H concentration increased and then slightly increased.",contradiction
"When the H concentration was 31.2 at%, a maximal bulk modulus of about 248 GPa was obtained, which slightly increased by 17% compared to that for the reference a-C film.",entailment
"Remediakis et al.,36 revealed that the bulk modulus of a-C films was enhanced as the film density increased (335 GPa at 2.7 g cm−3, 375 GPa at 3.05 g cm−3, and 465 GPa at 3.55 g cm−3).",entailment
"This experimental result showed a similar trend with our DFT results (212 GPa at 2.6 g cm−3, 351 GPa at 3.2 g cm−3, and 450 GPa at 3.5 g cm−3); however, there is some discrepancy since the amorphous phase is characterized by a short-range order and the atoms are bonded in randomly disordered positions due to a phenomenon that does not allow the formation of a regular arrangement.",contradiction
"Nevertheless, taking advantage of the benefits of the simulation, it is noted that the drastic increase in the bulk modulus is observed by increasing the atomic density of the a-C films, which suggests that it would be difficult for the films hardened by high atomic density to relieve the stress of the individual layers within the overall stack in integrated semiconductor devices.",contradiction
"However, the addition of hydrogen in the a-C films has little effect on increasing the bulk modulus even though the sp3 content increases.",contradiction
These findings suggest that the process design for high-sp3-content a-C films should be carried out by adding hydrogen rather than increasing the atomic density.,contradiction
"These requirements become more important and increasingly challenging to meet as the device integrity increases.37,38 To elucidate the mechanism of the increase in bulk modulus caused by atomic density and hydrogen concentrations, more direct evidence for the atomic bond structure including bond length distributions was collected first.",contradiction
"Fig. 3 shows the calculated results of the bond length and bond angle distributions for the dense a-C film with the highest atomic density of 4.0 g cm−3 and those for the H-added a-C film with the highest H concentration of 31.2 at%, in which the highest bulk modulus is observed, as shown in Fig. 2.",contradiction
"For comparison, the case for the Ref. a-C film was also considered.",contradiction
The total bond length and bond angle distributions shown in Fig. 3 mainly consist of a C–C bond.,contradiction
Li et al.39 revealed that the distortion of bond lengths (<1.42 Å) and bond angles (>120°) in the carbon network was the key factor for the low level of the bulk modulus.,contradiction
"Therefore, the bond lengths and bond angles in these three a-C films were particularly studied in order to gain the fractions of distorted bonds, which are illustrated in Table 1.",contradiction
"The equilibrium bond lengths of stable sp2 and sp3 C–C bonds are 1.42 and 1.54 Å, respectively (the black vertical dotted lines in Fig. 3).",contradiction
"The fractions of the distorted bond lengths (<1.42 Å) for the dense a-C film with the highest atomic density (4.0 g cm−3, sp3 content = 95.3%) and the H-added a-C film at maximum at% (31.2%, sp3 content = 76.6%) were deduced separately, as shown in Table 1.",contradiction
The calculations for the Ref. a-C film were also obtained for comparison.,contradiction
"For the Ref. a-C film (Fig. 3), the fractions of the distorted bond length and bond angle are 17.2%, and 35.8%, respectively.",contradiction
"For the dense a-C film, the fractions are 1.0% and 15.6%.",contradiction
"However, after adding H into the a-C film, the fractions are 14.3% and 33.1%, showing similar values to both the bulk modulus and the fraction of the distorted bond length of the Ref. a-C film.",contradiction
