sentence,true_label
"For example, the bulk moduli of diamond and boron nitride are 440 and 369 GPa, respectively.",entailment
"For comparison, a bulk modulus of 56.0 ± 1.4 GPa, with a pressure derivative of 5.3 ± 1.0, is calculated for CaS.",entailment
These structures exhibit Mexican hat-like valence band dispersion that can be approved by a singularity in the density of states.,contradiction
"The first-principles calculation reveals that the marcasite-type NiN2 is a narrow-gap semiconductor, and high-pressure in-situ X-ray diffraction measurements revealed a zero-pressure bulk modulus of 172(6) GPa.",entailment
The formula for bulk modulus is bulk modulus = - ( pressure applied / fractional change in volume).,contradiction
"Here Ru d- and O p-orbitals overlap, resulting in covalent bonding and a high calculated bulk modulus both for this material and for its osmium analogue, OsO2.",contradiction
"The extrapolated bulk modulus of the high-pressure phase III of cubic tetrakis(trimethylsilyl)methane C[Si(CH3)3]4 (TC) (P < 16.0 GPa, T = 298 K) was determined to be K0 = 7.1 (8) GPa.",entailment
"The bulk modulus was then accepted as 140 GPa, and this was reinforced when theory also obtained a similar value.",entailment
A material with a bulk modulus of 35 GPa loses one percent of its volume when subjected to an external pressure of 0.35 GPa (~3500 bar).,contradiction
"The bulk modulus of the beryllium tetrahedron in BeO is 210 GPa, identical to that of the crystal, and close to the value observed for beryllium tetrahedra in other beryllium minerals.",entailment
"We show that this increase in bulk modulus can be explained in terms of the transition between relaxed and unrelaxed moduli that is observed at zero pressure, low temperatures, and higher frequencies.",contradiction
Some men are playing a sport,contradiction
"Sharp absorption edges are found, reaching 8 μm near y =0.3.",contradiction
"Highly functional hybrids derived from the sol-gel process are being developed for practical applications such as coatings, contact lenses and non-linear optical, electrochromic, and electroconductive materials.",contradiction
Sheer bulk modulus of Ni was found to increase in this experiment.,contradiction
"When the gas is not ideal, these equations give only an approximation of the bulk modulus.",contradiction
RCoO3 yield a pressure of 80 GPa under extreme temperature.,contradiction
"For Berea sandstone, best fit values were drained bulk modulus, 6.6 GPa; undrained bulk modulus, 15.8 GPa; drained Poisson's ratio, 0.17; undmined Poisson's ratio, 0.34.",entailment
"Other moduli describe the material's response (strain) to other kinds of stress: the shear modulus describes the response to shear, and Young's modulus describes the response to linear stress. For a fluid, only the bulk modulus is meaningful.",contradiction
"Adsorbed volumes of solid chemicals were observed to be less than those of liquids at the same adsorption potential density, consistent with a reduction in packing efficiency and as previously reported for activated carbons.",contradiction
The zero-pressure bulk modulus of SiC2 is one of the highest known in crystalline materials at 230 GPa.,entailment
"The enhancement of the bulk modulus and the reduction in transition pressure in nanocrystalline γ-Fe2O3 have been confirmed in several experimental runs, including the use of two different pressuretransmitting media.",contradiction
"One of the principal characteristics of materials is their ability (or lack of ability) to conduct electrical current. Indeed, materials are classified by this property, that is, they are divided into conductors, semiconductors, and nonconductors. ",contradiction
"Coefficients of the BM3 equation of state are as follows: zero-pressure volume 498.4(7) Å 3 ,bulk modulus K 0 36.6(15) GPa and its pressure derivative 6.4(5).",entailment
"The bulk modulus of MgO was determined to be 135(3) GPa at a temperature of 1100 K, yielding its temperature derivative of 20.030(3) GPa/K.",entailment
It is possible to measure the bulk modulus using powder diffraction under applied pressure.,contradiction
"According to site, bulk modulus B of coarse-crystalline silver sulfide is from 26 to 34 GPa.",entailment
"The bulk modulus of the present work is obtained from the equation of state in a pressure range up to 10 GPa and valid for the crystalline core, making it difficult to compare with the result of Trapp et al.",contradiction
"Here we report the synthesis of metallic, ultraincompressible (bulk modulus K0 = 428(10) GPa) and very hard (nanoindentation hardness 36.7(8) GPa) rhenium (V) nitride pernitride Re2(N2)N2.",entailment
"Using empirical formula developed by ourselves, bulk modulus B0 was found approximately 12–26 GPa(see table 12).",contradiction
"At 0 GPa and 300 K, the B for the studied CuMn2InSe4 compound is equal to 40.20 GPa.",entailment
A least-squares fit to the experimental data at room temperature yielded bulk modulus K 0 = 170 ± 8 GPa with a corresponding pressure derivative K 0 ′ = 2.6 ± 0.5 or K 0 = 150 ± 2 GPa with fixed K 0 ′ = 4.,entailment
"For comparison, the bulk modulus of alumina is 254 GPa, close to the bulk modulus of the 67 nm particles.",entailment
A large change in elasticity in BaTiO3 associated with the structural transition (without a significant volume change) is a clear example of the breakdown of the Birch's law between densities and elastic wave velocities.,contradiction
"A third order Birch–Murnaghan fit of the unit cell volume as a function of pressure for all experimental points, yielded a zero pressure bulk modulus K0=142(7) GPa GPa, and its pressure derivative K′0=3.3(0.2) for the high-pressure tetragonal phase of TiH2 and with K′0 held at four, K0=130(5) GPa.",entailment
Bulk modulus is defined as the ratio of the infinitesimal pressure increase to the resulting relative decrease of the volume.,contradiction
Cotunnite-structured (OII phase; space group Pnma) ZrO 2 and HfO 2 have extremely high bulk moduli of 444 and 340 GPa.,entailment
Yielding the liquidus phase requires bulk modulus to be at 12.0 GPa.,contradiction
"Liquids at pressures up to 12 GPa for three alkali silicate compositions (Na2Si2O5, Na2Si4O9, K2Si4O9) and silica (SiO2) reveal systematic changes in the melt structure.",contradiction
Replicas of the hybridized states are observed at the centre of twist angle-dependent moiré mini Brillouin zones,contradiction
"For inorganic ionic salts, /J K-1 mol-1 = 1360 (Vm/nm3 formula unit-1) + 15 or = 2.258 [M/(Ï/g cm-3)] + 15. For ionic hydrates, /J K-1 mol-1 = 1579 (Vm/nm3 formula unit-1) + 6 or = 2.621 [M/(Ï/g cm-3)] + 6. For minerals, /J K-1 mol-1 = 1262 (Vm/nm3 formula unit-1) + 13 or = 2.095 [M/(Ï/g cm-3)] + 13.",contradiction
Fe yielded pressure of 48 GPa.,contradiction
The bulk modulus of brucite is thus likely to lie closer to 40 than to 50 GPa; measurements of elastic constants by ultrasonic methods or Brillouin scattering are needed to obtain a more accurate value. A,entailment
"The bulk modulus of pyrope, calculated with the polyhedral bulk moduli weighted by their volume fraction, is 165 GPa, which is comparable to the value 171(2) GPa determined from the unit-cell volume.",entailment
"We performed a series of experiments in the system Fe-FeS at a pressure of 21 GPa and temperatures between 950 and 1400 °C, and we found two new iron-excess iron-sulfur compounds, Fe3S and Fe2S, formed at subsolidus temperatures. ",contradiction
Acoustic velocities and refractive index of SiO2 glass to 57.5 GPa by Brillouin scattering.,contradiction
"The bandgap increases with tensile strain, whereas, compressive strain leads to semiconductor-to-metal transition.",contradiction
"In this paper we present Aflow (Automatic Flow), a software framework for high-throughput calculation of crystal structure properties of alloys, intermetallics and inorganic compounds.",contradiction
We calculated bulk modulus in GPa is consistent with experimental values.,contradiction
Optical absorption of these compounds shows that the second and lower valence bands due to the high density of states display a higher contribution to optical transitions.,contradiction
"Based upon simulation results and reanalysis of experimental data, the commonly accepted value of the initial isothermal bulk modulus for β-HMX should be revised from a value of ∼12.4–13.5 GPa∼12.4–13.5 GPa to ∼15–16 GPa.",entailment
"A curve-fit with a truncated third-order Birch–Murnaghan equation of state with a fixed K'o = 4 to pressure-normalized volume data yielded the isothermal bulk modulus, Ko = 43 ± 4 GPa, indicating that basic sodalite is more compressible than sodalite, possibly due to a difference in interactions between the framework host and the guest molecules.",entailment
"The influences of electron localization/delocalization and the tunable bandgap on thermal behaviors such as the electronic thermal conductivity, the Seebeck coefficient, and the figure of merit, and optical properties such as the dielectric function, the excitation spectra, the refractive index, the electron energy loss spectra, the reflectivity, and the optical conductivity are presented.",contradiction
"The best fit yielded a 300-K isothermal bulk modulus K 0 = 174 ± 6 GPa, and its pressure derivative at constant temperature K 0 ′ =(K 0 /P) T = 4.8±0.8.",entailment
"At atmospheric pressure, the room temperature bulk moduli BT are 2.0 GPa for PIB-2800 and 2.5 GPa for PIB-85000 with dBT/dp = 10 for both.",entailment
"In addition, the total-energy calculation for pyrite structure has also been performed, which indicates its mechanical and energetic stability but much lower bulk modulus compared to the fluorite structure",contradiction
"We determined its extremely high Young's and shear moduli of 1691 and 1113 GPa, respectively, surpassing those of diamond by 1.5 and 2 times.",entailment
"Again, the predicted zero-pressure lattice parameter 5.364 Å agrees with the corresponding experimental value 5.394(2) Å within 0.5%, whereas the calculated zero-pressure bulk modulus 176.8 GPa is 8% lower than the experimental value.",entailment
The results demonstrate that CoFeB is a promising material for the development of superconducting spintronic devices.,contradiction
"It is this property which entices automobile manufacturers to replace denser materials, not only steels, cast irons and copper base alloys but even aluminium alloys by magnesium based alloys.",contradiction
"With a C,C bond force constant equal to that between adjacent carbon atoms in graphite, 7.08 mdyn/Å, a bulk modulus of 903 GPa is obtained.",entailment
"The experimental values for the zero-pressure bulk modulus of CeO2 and PrO2 are 220(9) and 187(8) GPa, respectively.",entailment
"High-pressure X-ray diffraction data on an NaH to 54 GPa at room temperature show the isothermal bulk modulus B0 with an NaCl-type structure is 19.40±2.00 GPa, with a pressure derivative B0′ of 4.40±0.50.",entailment
"The bulk modulus (B0) and the atomic volume at atmospheric pressure (V0) of the sh phase were estimated to be 84.1 GPa and 14.2 Å3, with a fixed value of the pressure derivative of the bulk modulus (B0) equal to 4.",entailment
The bulk modulus of SmFeAs(O0.93F0.07) was calculated (K0 = 103 GPa) using a 3rd order Birch–Murnaghan equation of state and resulted in quite good agreement with theoretical calculations reported for LaFeAsO.,entailment
The band-gap has been calculated within the MBJLDA approximation.,contradiction
The values obtained all exceed the bulk modulus (441 GPa) of diamond.,entailment
"Using empirical formula developed by ourselves, bulk modulus of ZnCO2 was found approximately 12–26 GPa(see table 12).",entailment
Polarization versus electric field (P–E) studies demonstrate that the value of polarization decreases from 0.73 to 0.37 μC/cm2 as Mn concentration increases from x = 0 to 0.07.,contradiction
For the specific volume of 59.65 ± 0.07 Å3 the average measured isothermal bulk modulus of scandia from the present study and recent literature results is 188 ± 10 GPa.,entailment
"The bulk modulus and shear modulus of C16 are 365 GPa, 313 GPa, and those of C24 are 363 GPa, 308 GPa, which are larger than T-C9, oP8 carbon, C96 and tP40 carbon.",entailment
"The shear modulus (224 GPa) and bulk modulus (269 GPa) of oP72 carbon are both slightly larger than those of C64, Y carbon, TY carbon, and T carbon, and the shear modulus of oP72 carbon is slightly greater than that of Pnma-BN.",entailment
"In this paper, semiempirical formula for the bulk modulus (B in GPa) of perovskite structured solids are elaborated in terms of lattice constant (a in Å) and product of ionic charges (ZaZbZc ) of the bonding.",contradiction
"By means of depth-sensing nanoindentation experiments, we directly evaluate the Young's modulus of bulk single crystals of tin selenide (25.3 GPa), as well as their hardness (0.82 GPa).",contradiction
It has a low bulk modulus and Debye temperature despite of its non-layered structure.,contradiction
"The bulk modulus of m-BN is 329 GPa, which is smaller than that of Pbca-BN and c-BN, but the Young's modulus and shear modulus of m-BN are greater than that of Pbca-BN.",entailment
"Based on the compression test data, the Young’s modulus is obtained as a function of temperature, and the Young’s modulus at 1292 °C estimated from the compression test data is about 8.0 GPa, only one fifty-first of the value at 20 °C.",contradiction
The bulk modulus of nanowires (NWs) and its temperature dependence were determined by a simple and convenient method based on temperature-dependent X-ray diffraction (XRD) measurement.,contradiction
"The shear modulus G, Young's modulus E, and bulk modulus B of BCN2 and CN are 253 and 310 GPa; 448 and 719 GPa; and 186 and 323 GPa with GGA functional, respectively.",entailment
"The first pressure derivative of the isothermal bulk modulus increases with the increase of temperature when P &lt;100GPa, and then gradually keep a constant when P &gt;100GPa.",contradiction
"The second pressure derivative of isothermal bulk modulus decreases with the increase of temperature when P &lt;40GPa, and then keep a constant when P &gt;40GPa. ",contradiction
"The starting hexagonal structure transforms to an intermediate phase and I4/mmm structure above 10 GPa, and then converts into the I4/mmm structure completely above 47.2 GPa.",contradiction
"Under these conditions, the bulk modulus (K0) was estimated to be 6.5(4) GPa, with clear amorphization of the material at pressures beyond 0.34 GP.",entailment
"For small-molecule fluids, such as isopropanol and methanol/ethanol/water mixtures, HKUST-1 exhibits two distinct regimes of compression: at lower pressures the apparent bulk modulus is exceptionally high (K0 = 117.6(1) GPa), while at higher pressure compression occurs at a more reasonably expected rate, with bulk moduli between 25.9(5) and 41.9(4) GPa.",entailment
"Conversely, when a non-penetrating pressure transmitting fluid (in this case, FluorinertTM FC-70) is used, the observed bulk modulus is 29.5(7) GPa throughout the hydrostatic limit of the fluid.",entailment
"Mattesini, Soler, and Ynduráin computed the bulk modulus and Young's modulus of MOF-5 in 2006, predicting that the material is readily compressible and soft, with a Young's modulus similar to that of Oak wood (14.8 GPa.",contradiction
"As the defect density increases from ∼3% to ∼26% of linkers missing, the bulk modulus decreases as expected; however, at higher defect densities (∼28% missing linkers), the bulk modulus of UiO-66 appears to increase (Fig. 7).",contradiction
"This study reports two more new iron-sulfide compounds (Fe2S and Fe3S) formed at pressures greater than 21 GPa, and provides the crystal structure and bulk modulus of Fe3S.",contradiction
A least-squares fit of the third order Birch-Murnaghan equation of state to the compression data yielded bulk modulus K0 = 170 ± 8 GPa and its pressure derivative K0′ = 2.6 ± 0.5 (Fig. 2).,entailment
"If the pressure derivative K0′ is fixed to 4, the calculated bulk modulus is K0 = 150 ± 2 GPa.",entailment
The SrN2 was compressed up to 43.2 GPa.,contradiction
The XRD patterns are demonstrated in Fig. 3.,contradiction
"Nine diffraction peaks of SrN2, which belong to (101), (002), (110), (112), (200), (103), (211), (202), and (004) planes, were observed.",contradiction
"The diffraction peaks of (200) disappeared at 6.4 GPa, and (211) and (202) disappeared at 10.0 GPa.",contradiction
The strongest diffraction peak of (101) finally disappeared at 12.0 GPa.,contradiction
The disappearance of the diffraction peaks is temporarily assigned as a possible phase transition.,contradiction
The high-pressure phase is stable up to 43.2 GPa in this study.,contradiction
The peaks of HP-SrN2 indexing results led to an orthorhombic structure.,contradiction
"However, it is difficult to determine the structure of the phase of HP-SrN2 because the diffraction diagrams are significantly broadened and low intensity at higher pressure.",contradiction
It is worth noting that the detection of the changes of the diazenide anions positions is an inherent challenge for synchrotron XRD measurements owing to their greatly low scattering cross-section.,contradiction
"Therefore, a symmetry breaking due to the changes of diazenide anions orientation cannot be observed in synchrotron X-ray diffraction.",contradiction
The similar phenomenon in SrO2 was observed.33 The influence of oxide atoms in SrO2 was entirely ignored on the XRD patterns owing to their low scattering cross section.,contradiction
We temporally ascribe the phase transition of SrN2 to the rotation of diazenide units and the rearrangement of Sr ions according to the rotation character of diazenide units in CaN2 (ref. 19) under high pressure.,contradiction
"As pressure is released to 0.6 GPa, the tetragonal structure recovered from the high-pressure orthorhombic structure, demonstrating a reversible phase transition of SrN2.",contradiction
"Compared to the starting conditions, the figure of the back-transformed SrN2 shows differences in intensities and is broadened, which are presumably caused by preferred orientation and grain size effects, respectively.",contradiction
The bulk modulus of SrN2 was fitted to the Birch–Murnaghan equation of state (EOS)where V0 is the unit cell volume at ambient pressure and V is the volume at the pressure of P.,contradiction
B0 is the bulk modulus at zero pressure and image file d0ra00789g-t3.tif is the pressure derivative of B0.,contradiction
The data measured below 11.2 GPa were used to yield the bulk modulus because the phase transitions occur at 12.0 GPa.,contradiction
The bulk modulus of B0 = 132.4 (10.2) GPa of SrN2 is conforming to the Birch–Murnaghan EOS.,entailment
"The bulk modulus of SrN2 is close to that of CaN2 (113.2 GPa),21 which can be interpreted by the fact that SrN2 and CaN2 are isostructural at ambient conditions.",entailment
The experimental pressure evolutions of the unit cell volume of SrN2 are plotted in Fig. 5.,contradiction
"The bulk modulus of SrN2 was theoretically predicted to be 96.08 GPa and 65 GPa using pseudo-atomic calculations with the local density approximation (LDA) and the generalized gradient approximation Perdew–Burke–Ernzerhof (GGA-PBE), and the ab initio calculations with the GGA-PBE, respectively, by Zhang et al.20 and Wessel et al.,15 in which the pseudo-atomic calculations results are closer to the experimental results.",entailment
The different calculation methods employed different empirical or theoretical approximations are suitable for different materials.,contradiction
"Compare our experimental results with reported calculations results, the pseudo-atomic calculations with the LDA and the GGA-PBE were better fitted diazenides than the ab initio calculations with the GGA-PBE.",contradiction
The bulk modulus of SrN2 is two times larger than its corresponding metal azide Sr(N3)2 (123.7 GPa of SrN2 vs. 49.1 GPa of Sr(N3)2 (ref. 34)).,entailment
"The nitrogen bonds are formed as double bonding in both diazenides anions (N[double bond, length as m-dash]N)2− and azides anions (N[double bond, length as m-dash]N[double bond, length as m-dash]N)−.11 The previous studies proved that the N[double bond, length as m-dash]N plays a crucial role in the compressibility of both Sr(N3)2 and SrN2.",contradiction
"The N[double bond, length as m-dash]N bond distance of 1.226 (3) Å in SrN2 is longer than that of 1.184 (2) Å in Sr(N3)2 leading to weaker N[double bond, length as m-dash]N bonds in SrN2.",contradiction
"The bulk modulus of SrN2 is larger than that of Sr(N3)2, which contradict to the longer N[double bond, length as m-dash]N bond of SrN2.",contradiction
We thus infer the interaction between Sr and N in SrN2 is much stronger than that in Sr(N3)2.,contradiction
"To obtain deeper insight into the nature of chemical bonding between Sr and N in SrN2 and Sr(N3)2, we performed crystal orbital overlap population (COHP) analysis.",contradiction
"COHP can divide the band-structure energy into the orbital pair interactions, which is used to indicate the contribution of bonding, nonbonding, and antibonding to the band-structure energy.",contradiction
"Our analysis showed that bonding states are fully occupied and antibonding states are partially occupied in SrN2, while both bonding states and anti-bonding states are partially occupied in Sr(N3)2, as shown in Fig. 6, leading to strong covalent bonding between Sr and N atoms in SrN2 and Sr(N3)2.",contradiction
"Furthermore, the bonding strength can be expressed by the values of integrated crystal orbital Hamilton population (ICOHP), which are in the order of −1.233 and −0.736 for SrN2 and Sr(N3)2, respectively, as shown in Fig. 6.",contradiction
It is confirmed that interaction between Sr1–N1 atoms is stronger than that of Sr2–N2 atoms.,contradiction
"Hence, covalent bonding between Sr and N atoms is stronger in SrN2, which resulted in a larger bulk modulus.",contradiction
"In this work, the SrN2 was synthesized by using the controlled decomposition of the Sr(N3)2 under high-pressure and high-temperature conditions.",contradiction
The high-pressure in situ synchrotron XRD study of the synthesized SrN2 up to 43.2 GPa revealed a pressure-induced tetragonal-to-orthorhombic phase transition at 12.0 GPa due to the rotation of diazenide units and the rearrangement of Sr ions.,contradiction
The compressibility of SrN2 is anisotropic due to the orientation of the diazenide anions.,contradiction
The bulk modulus of SrN2 is B0 = 132.4 (10.2) GPa.,entailment
"In order to further analyze the bulk modulus of SrN2 and Sr(N3)2, we calculated the bonding strength via computing the values of ICOHP, which shows stronger Sr–N covalent bonds in SrN2 than that in Sr(N3)2, leading the larger value of bulk modulus than that of Sr(N3)2.",contradiction
"In this work, strontium diazenide (SrN2) was synthesized using strontium azide as a starting material in a Walker-type module under high-pressure and high-temperature conditions.",contradiction
The synthesized SrN2 was further studied under high pressure up to 43.2 GPa using in situ synchrotron X-ray diffraction to supplement the high-pressure exploration of alkaline earth diazenides.,contradiction
The SrN2 underwent a possible phase transition from a tetragonal structure into an orthorhombic structure at 12.0 GPa.,contradiction
SrN2 shows anisotropic compressibility due to the orientation of the diazenide anions.,contradiction
"The bulk modulus of SrN2 is 132.4 (10.2) GPa, which is larger than that of Sr(N3)2.",entailment
"The larger bulk modulus of SrN2 is attributed to the stronger covalent strength between Sr and N atoms in SrN2, which is confirmed by our theoretical calculations.",contradiction
"To further evaluate the stabilities and examine the electronic structure, Fig. S2† shows the total and partial density of state (DOS) of the predicted 23 MAB phases.",contradiction
The finite DOS at the Fermi energy for all those MABs reveal their metallic character.,contradiction
"The total density of states near the Fermi level are dominated by transition metal atoms, while the lower lying states are dominated by B and Al atoms.",contradiction
"As the valence electron number of M metal increases, the number of states lower than Fermi level increases because of valance electron filling, which push the total density of states to lower energy and are mainly responsible for the stability.",contradiction
"As suggested in pervious literature,11 the stability of the metallic materials is roughly relative to the pseudogap formation.",contradiction
"That is to say, a local minimum (dip) at Fermi energy level (Ef) for metals implies higher structural stability, while a local maximum Ef is usually a sign of structural instability.",contradiction
"Among our predicted 23 MABs, Cr2Al2B2, Mo2Al2B2 and W2Al2B2 have their Ef located at a local minimum in the total density of state (TDOS), suggesting their higher level of stability.",contradiction
These results are indirectly supported by the experimental findings of Mo2Al2B2 and W2Al2B2 phases.,contradiction
"Meanwhile, we demonstrated again that Cr2Al2B2 is a very promising candidate for experimental synthesis.",contradiction
"In addition, V2Al2B2, V2AlB2 and Nb2AlB2 show a peak in the TDOS at the Fermi level, suggesting a relative lower stability than Cr2Al2B2, Mo2Al2B2 and W2Al2B2.",contradiction
"However, they might show better conductive performance than the other MABs systems reported here (Fig. S2†).",contradiction
"To promote their practical engineering applications, we have also investigated the mechanical properties of 222-MAB and 212-MAB phases.",contradiction
